{
  "version": 1,
  "request_id": "req-0001-t3101",
  "lever": "user.reset-mfa",
  "lever_version": 1,
  "client": "contoso-dental",
  "mode": "dry-run",
  "params": {
    "upn": "priya.nair@contosodental.example"
  },
  "entry": {
    "module": "IdentityLevers",
    "function": "Reset-UserMfa"
  },
  "as_of": "2026-10-21",
  "adapter": {
    "system": "m365",
    "implementation": "mock",
    "external_id": "c0000000-0000-4000-8000-000000000001"
  }
}
